<?xml version="1.0" encoding="UTF-8"?>
<fafram xmlns="org.jboss.fuse.qa"
		xmlns:xsi="http://www.w3.org/2001/XMLSchema-instance"
		xsi:schemaLocation="org.jboss.fuse.qa  config.scheme.xsd">

	<framework></framework>

	<container type="root" instances="1">
		<username>admin</username>
		<password>admin</password>
		<name>root1</name>
		<node host="openstack" username="fuse" password="fuse"/>
	</container>

	<container instances="1" type="ssh">
		<name>fafram8-ssh-container-a</name>
		<parent>root1</parent>
		<node host="openstack" username="fuse" password="fuse"/>
	</container>

	<container instances="1" type="ssh">
		<parent>root1</parent>
		<name>fafram8-ssh-container-b</name>
		<node host="openstack" username="fuse" password="fuse"/>
	</container>

</fafram>